<?xml version="1.0" encoding="utf-8" ?>
<!DOCTYPE SCD[
  <!ELEMENT SCD (Screen*, CmnTransition*)>
  <!ELEMENT Screen (Transition*)>
  <!ELEMENT Transition EMPTY>
  <!ELEMENT CmnTransition EMPTY>
  <!ATTLIST Screen
    value CDATA #REQUIRED
    directLink (allow|deny) "allow">
  <!ATTLIST Transition
    value CDATA #REQUIRED
    label CDATA #REQUIRED
    mode  (T|R) #IMPLIED>
  <!ATTLIST CmnTransition
    value CDATA #REQUIRED
    label ID #REQUIRED
    mode  (T|R) #IMPLIED>
]>
<!-- Screenタグの現画面の仮想パスはIDにできるが、
「/」を含むため、XMLのIDとしては利用できない。 -->
<SCD>
  <Screen value="/ProjectX_sample/Aspx/start/login.aspx" directLink="allow">
  </Screen>
  <Screen value="/ProjectX_sample/Aspx/start/menu.aspx" directLink="allow">
  </Screen>
  <Screen value="id_1" directLink="deny">
    <Transition value="aaa.aspx" label="aaa" mode ="T"/>
    <Transition value="bbb.aspx" label="bbb" mode ="R"/>
    <Transition value="ccc.aspx" label="ccc" mode ="T"/>
    <Transition value="ddd.aspx" label="ddd" mode ="R"/>
    <Transition value="eee.aspx" label="eee" mode ="T"/>
  </Screen>
  <Screen value="id_2" directLink="deny">
    <Transition value="aaa.aspx" label="aaa" mode ="T"/>
    <Transition value="bbb.aspx" label="bbb" mode ="R"/>
    <Transition value="ccc.aspx" label="ccc" mode ="T"/>
    <Transition value="ddd.aspx" label="ddd" mode ="R"/>
    <Transition value="eee.aspx" label="eee" mode ="T"/>
  </Screen>
  <Screen value="id_3" directLink="deny">
    <Transition value="aaa.aspx" label="aaa" mode ="T"/>
    <Transition value="bbb.aspx" label="bbb" mode ="R"/>
    <Transition value="ccc.aspx" label="ccc" mode ="T"/>
    <Transition value="ddd.aspx" label="ddd" mode ="R"/>
    <Transition value="eee.aspx" label="eee" mode ="T"/>
  </Screen>
  <Screen value="id_4" directLink="deny">
    <Transition value="aaa.aspx" label="aaa" mode ="T"/>
    <Transition value="bbb.aspx" label="bbb" mode ="R"/>
    <Transition value="ccc.aspx" label="ccc" mode ="T"/>
    <Transition value="ddd.aspx" label="ddd" mode ="R"/>
    <Transition value="eee.aspx" label="eee" mode ="T"/>
  </Screen>
  <Screen value="id_5" directLink="deny">
    <Transition value="aaa.aspx" label="aaa" mode ="T"/>
    <Transition value="bbb.aspx" label="bbb" mode ="R"/>
    <Transition value="ccc.aspx" label="ccc" mode ="T"/>
    <Transition value="ddd.aspx" label="ddd" mode ="R"/>
    <Transition value="eee.aspx" label="eee" mode ="T"/>
  </Screen>
  <Screen value="id_6" directLink="deny">
    <Transition value="aaa.aspx" label="aaa" mode ="T"/>
    <Transition value="bbb.aspx" label="bbb" mode ="R"/>
    <Transition value="ccc.aspx" label="ccc" mode ="T"/>
    <Transition value="ddd.aspx" label="ddd" mode ="R"/>
    <Transition value="eee.aspx" label="eee" mode ="T"/>
  </Screen>
  <Screen value="id_7" directLink="deny">
    <Transition value="aaa.aspx" label="aaa" mode ="T"/>
    <Transition value="bbb.aspx" label="bbb" mode ="R"/>
    <Transition value="ccc.aspx" label="ccc" mode ="T"/>
    <Transition value="ddd.aspx" label="ddd" mode ="R"/>
    <Transition value="eee.aspx" label="eee" mode ="T"/>
  </Screen>
  <Screen value="id_8" directLink="deny">
    <Transition value="aaa.aspx" label="aaa" mode ="T"/>
    <Transition value="bbb.aspx" label="bbb" mode ="R"/>
    <Transition value="ccc.aspx" label="ccc" mode ="T"/>
    <Transition value="ddd.aspx" label="ddd" mode ="R"/>
    <Transition value="eee.aspx" label="eee" mode ="T"/>
  </Screen>
  <Screen value="id_9" directLink="deny">
    <Transition value="aaa.aspx" label="aaa" mode ="T"/>
    <Transition value="bbb.aspx" label="bbb" mode ="R"/>
    <Transition value="ccc.aspx" label="ccc" mode ="T"/>
    <Transition value="ddd.aspx" label="ddd" mode ="R"/>
    <Transition value="eee.aspx" label="eee" mode ="T"/>
  </Screen>
  <Screen value="id_10" directLink="deny">
    <Transition value="aaa.aspx" label="aaa" mode ="T"/>
    <Transition value="bbb.aspx" label="bbb" mode ="R"/>
    <Transition value="ccc.aspx" label="ccc" mode ="T"/>
    <Transition value="ddd.aspx" label="ddd" mode ="R"/>
    <Transition value="eee.aspx" label="eee" mode ="T"/>
  </Screen>
  <Screen value="id_11" directLink="deny">
    <Transition value="aaa.aspx" label="aaa" mode ="T"/>
    <Transition value="bbb.aspx" label="bbb" mode ="R"/>
    <Transition value="ccc.aspx" label="ccc" mode ="T"/>
    <Transition value="ddd.aspx" label="ddd" mode ="R"/>
    <Transition value="eee.aspx" label="eee" mode ="T"/>
  </Screen>
  <Screen value="id_12" directLink="deny">
    <Transition value="aaa.aspx" label="aaa" mode ="T"/>
    <Transition value="bbb.aspx" label="bbb" mode ="R"/>
    <Transition value="ccc.aspx" label="ccc" mode ="T"/>
    <Transition value="ddd.aspx" label="ddd" mode ="R"/>
    <Transition value="eee.aspx" label="eee" mode ="T"/>
  </Screen>
  <Screen value="id_13" directLink="deny">
    <Transition value="aaa.aspx" label="aaa" mode ="T"/>
    <Transition value="bbb.aspx" label="bbb" mode ="R"/>
    <Transition value="ccc.aspx" label="ccc" mode ="T"/>
    <Transition value="ddd.aspx" label="ddd" mode ="R"/>
    <Transition value="eee.aspx" label="eee" mode ="T"/>
  </Screen>
  <Screen value="id_14" directLink="deny">
    <Transition value="aaa.aspx" label="aaa" mode ="T"/>
    <Transition value="bbb.aspx" label="bbb" mode ="R"/>
    <Transition value="ccc.aspx" label="ccc" mode ="T"/>
    <Transition value="ddd.aspx" label="ddd" mode ="R"/>
    <Transition value="eee.aspx" label="eee" mode ="T"/>
  </Screen>
  <Screen value="id_15" directLink="deny">
    <Transition value="aaa.aspx" label="aaa" mode ="T"/>
    <Transition value="bbb.aspx" label="bbb" mode ="R"/>
    <Transition value="ccc.aspx" label="ccc" mode ="T"/>
    <Transition value="ddd.aspx" label="ddd" mode ="R"/>
    <Transition value="eee.aspx" label="eee" mode ="T"/>
  </Screen>
  <Screen value="id_16" directLink="deny">
    <Transition value="aaa.aspx" label="aaa" mode ="T"/>
    <Transition value="bbb.aspx" label="bbb" mode ="R"/>
    <Transition value="ccc.aspx" label="ccc" mode ="T"/>
    <Transition value="ddd.aspx" label="ddd" mode ="R"/>
    <Transition value="eee.aspx" label="eee" mode ="T"/>
  </Screen>
  <Screen value="id_17" directLink="deny">
    <Transition value="aaa.aspx" label="aaa" mode ="T"/>
    <Transition value="bbb.aspx" label="bbb" mode ="R"/>
    <Transition value="ccc.aspx" label="ccc" mode ="T"/>
    <Transition value="ddd.aspx" label="ddd" mode ="R"/>
    <Transition value="eee.aspx" label="eee" mode ="T"/>
  </Screen>
  <Screen value="id_18" directLink="deny">
    <Transition value="aaa.aspx" label="aaa" mode ="T"/>
    <Transition value="bbb.aspx" label="bbb" mode ="R"/>
    <Transition value="ccc.aspx" label="ccc" mode ="T"/>
    <Transition value="ddd.aspx" label="ddd" mode ="R"/>
    <Transition value="eee.aspx" label="eee" mode ="T"/>
  </Screen>
  <Screen value="id_19" directLink="deny">
    <Transition value="aaa.aspx" label="aaa" mode ="T"/>
    <Transition value="bbb.aspx" label="bbb" mode ="R"/>
    <Transition value="ccc.aspx" label="ccc" mode ="T"/>
    <Transition value="ddd.aspx" label="ddd" mode ="R"/>
    <Transition value="eee.aspx" label="eee" mode ="T"/>
  </Screen>
  <Screen value="id_20" directLink="deny">
    <Transition value="aaa.aspx" label="aaa" mode ="T"/>
    <Transition value="bbb.aspx" label="bbb" mode ="R"/>
    <Transition value="ccc.aspx" label="ccc" mode ="T"/>
    <Transition value="ddd.aspx" label="ddd" mode ="R"/>
    <Transition value="eee.aspx" label="eee" mode ="T"/>
  </Screen>
  <Screen value="id_21" directLink="deny">
    <Transition value="aaa.aspx" label="aaa" mode ="T"/>
    <Transition value="bbb.aspx" label="bbb" mode ="R"/>
    <Transition value="ccc.aspx" label="ccc" mode ="T"/>
    <Transition value="ddd.aspx" label="ddd" mode ="R"/>
    <Transition value="eee.aspx" label="eee" mode ="T"/>
  </Screen>
  <Screen value="id_22" directLink="deny">
    <Transition value="aaa.aspx" label="aaa" mode ="T"/>
    <Transition value="bbb.aspx" label="bbb" mode ="R"/>
    <Transition value="ccc.aspx" label="ccc" mode ="T"/>
    <Transition value="ddd.aspx" label="ddd" mode ="R"/>
    <Transition value="eee.aspx" label="eee" mode ="T"/>
  </Screen>
  <Screen value="id_23" directLink="deny">
    <Transition value="aaa.aspx" label="aaa" mode ="T"/>
    <Transition value="bbb.aspx" label="bbb" mode ="R"/>
    <Transition value="ccc.aspx" label="ccc" mode ="T"/>
    <Transition value="ddd.aspx" label="ddd" mode ="R"/>
    <Transition value="eee.aspx" label="eee" mode ="T"/>
  </Screen>
  <Screen value="id_24" directLink="deny">
    <Transition value="aaa.aspx" label="aaa" mode ="T"/>
    <Transition value="bbb.aspx" label="bbb" mode ="R"/>
    <Transition value="ccc.aspx" label="ccc" mode ="T"/>
    <Transition value="ddd.aspx" label="ddd" mode ="R"/>
    <Transition value="eee.aspx" label="eee" mode ="T"/>
  </Screen>
  <Screen value="id_25" directLink="deny">
    <Transition value="aaa.aspx" label="aaa" mode ="T"/>
    <Transition value="bbb.aspx" label="bbb" mode ="R"/>
    <Transition value="ccc.aspx" label="ccc" mode ="T"/>
    <Transition value="ddd.aspx" label="ddd" mode ="R"/>
    <Transition value="eee.aspx" label="eee" mode ="T"/>
  </Screen>
  <Screen value="id_26" directLink="deny">
    <Transition value="aaa.aspx" label="aaa" mode ="T"/>
    <Transition value="bbb.aspx" label="bbb" mode ="R"/>
    <Transition value="ccc.aspx" label="ccc" mode ="T"/>
    <Transition value="ddd.aspx" label="ddd" mode ="R"/>
    <Transition value="eee.aspx" label="eee" mode ="T"/>
  </Screen>
  <Screen value="id_27" directLink="deny">
    <Transition value="aaa.aspx" label="aaa" mode ="T"/>
    <Transition value="bbb.aspx" label="bbb" mode ="R"/>
    <Transition value="ccc.aspx" label="ccc" mode ="T"/>
    <Transition value="ddd.aspx" label="ddd" mode ="R"/>
    <Transition value="eee.aspx" label="eee" mode ="T"/>
  </Screen>
  <Screen value="id_28" directLink="deny">
    <Transition value="aaa.aspx" label="aaa" mode ="T"/>
    <Transition value="bbb.aspx" label="bbb" mode ="R"/>
    <Transition value="ccc.aspx" label="ccc" mode ="T"/>
    <Transition value="ddd.aspx" label="ddd" mode ="R"/>
    <Transition value="eee.aspx" label="eee" mode ="T"/>
  </Screen>
  <Screen value="id_29" directLink="deny">
    <Transition value="aaa.aspx" label="aaa" mode ="T"/>
    <Transition value="bbb.aspx" label="bbb" mode ="R"/>
    <Transition value="ccc.aspx" label="ccc" mode ="T"/>
    <Transition value="ddd.aspx" label="ddd" mode ="R"/>
    <Transition value="eee.aspx" label="eee" mode ="T"/>
  </Screen>
  <Screen value="id_30" directLink="deny">
    <Transition value="aaa.aspx" label="aaa" mode ="T"/>
    <Transition value="bbb.aspx" label="bbb" mode ="R"/>
    <Transition value="ccc.aspx" label="ccc" mode ="T"/>
    <Transition value="ddd.aspx" label="ddd" mode ="R"/>
    <Transition value="eee.aspx" label="eee" mode ="T"/>
  </Screen>
  <Screen value="id_31" directLink="deny">
    <Transition value="aaa.aspx" label="aaa" mode ="T"/>
    <Transition value="bbb.aspx" label="bbb" mode ="R"/>
    <Transition value="ccc.aspx" label="ccc" mode ="T"/>
    <Transition value="ddd.aspx" label="ddd" mode ="R"/>
    <Transition value="eee.aspx" label="eee" mode ="T"/>
  </Screen>
  <Screen value="id_32" directLink="deny">
    <Transition value="aaa.aspx" label="aaa" mode ="T"/>
    <Transition value="bbb.aspx" label="bbb" mode ="R"/>
    <Transition value="ccc.aspx" label="ccc" mode ="T"/>
    <Transition value="ddd.aspx" label="ddd" mode ="R"/>
    <Transition value="eee.aspx" label="eee" mode ="T"/>
  </Screen>
  <Screen value="id_33" directLink="deny">
    <Transition value="aaa.aspx" label="aaa" mode ="T"/>
    <Transition value="bbb.aspx" label="bbb" mode ="R"/>
    <Transition value="ccc.aspx" label="ccc" mode ="T"/>
    <Transition value="ddd.aspx" label="ddd" mode ="R"/>
    <Transition value="eee.aspx" label="eee" mode ="T"/>
  </Screen>
  <Screen value="id_34" directLink="deny">
    <Transition value="aaa.aspx" label="aaa" mode ="T"/>
    <Transition value="bbb.aspx" label="bbb" mode ="R"/>
    <Transition value="ccc.aspx" label="ccc" mode ="T"/>
    <Transition value="ddd.aspx" label="ddd" mode ="R"/>
    <Transition value="eee.aspx" label="eee" mode ="T"/>
  </Screen>
  <Screen value="id_35" directLink="deny">
    <Transition value="aaa.aspx" label="aaa" mode ="T"/>
    <Transition value="bbb.aspx" label="bbb" mode ="R"/>
    <Transition value="ccc.aspx" label="ccc" mode ="T"/>
    <Transition value="ddd.aspx" label="ddd" mode ="R"/>
    <Transition value="eee.aspx" label="eee" mode ="T"/>
  </Screen>
  <Screen value="id_36" directLink="deny">
    <Transition value="aaa.aspx" label="aaa" mode ="T"/>
    <Transition value="bbb.aspx" label="bbb" mode ="R"/>
    <Transition value="ccc.aspx" label="ccc" mode ="T"/>
    <Transition value="ddd.aspx" label="ddd" mode ="R"/>
    <Transition value="eee.aspx" label="eee" mode ="T"/>
  </Screen>
  <Screen value="id_37" directLink="deny">
    <Transition value="aaa.aspx" label="aaa" mode ="T"/>
    <Transition value="bbb.aspx" label="bbb" mode ="R"/>
    <Transition value="ccc.aspx" label="ccc" mode ="T"/>
    <Transition value="ddd.aspx" label="ddd" mode ="R"/>
    <Transition value="eee.aspx" label="eee" mode ="T"/>
  </Screen>
  <Screen value="id_38" directLink="deny">
    <Transition value="aaa.aspx" label="aaa" mode ="T"/>
    <Transition value="bbb.aspx" label="bbb" mode ="R"/>
    <Transition value="ccc.aspx" label="ccc" mode ="T"/>
    <Transition value="ddd.aspx" label="ddd" mode ="R"/>
    <Transition value="eee.aspx" label="eee" mode ="T"/>
  </Screen>
  <Screen value="id_39" directLink="deny">
    <Transition value="aaa.aspx" label="aaa" mode ="T"/>
    <Transition value="bbb.aspx" label="bbb" mode ="R"/>
    <Transition value="ccc.aspx" label="ccc" mode ="T"/>
    <Transition value="ddd.aspx" label="ddd" mode ="R"/>
    <Transition value="eee.aspx" label="eee" mode ="T"/>
  </Screen>
  <Screen value="id_40" directLink="deny">
    <Transition value="aaa.aspx" label="aaa" mode ="T"/>
    <Transition value="bbb.aspx" label="bbb" mode ="R"/>
    <Transition value="ccc.aspx" label="ccc" mode ="T"/>
    <Transition value="ddd.aspx" label="ddd" mode ="R"/>
    <Transition value="eee.aspx" label="eee" mode ="T"/>
  </Screen>
  <Screen value="id_41" directLink="deny">
    <Transition value="aaa.aspx" label="aaa" mode ="T"/>
    <Transition value="bbb.aspx" label="bbb" mode ="R"/>
    <Transition value="ccc.aspx" label="ccc" mode ="T"/>
    <Transition value="ddd.aspx" label="ddd" mode ="R"/>
    <Transition value="eee.aspx" label="eee" mode ="T"/>
  </Screen>
  <Screen value="id_42" directLink="deny">
    <Transition value="aaa.aspx" label="aaa" mode ="T"/>
    <Transition value="bbb.aspx" label="bbb" mode ="R"/>
    <Transition value="ccc.aspx" label="ccc" mode ="T"/>
    <Transition value="ddd.aspx" label="ddd" mode ="R"/>
    <Transition value="eee.aspx" label="eee" mode ="T"/>
  </Screen>
  <Screen value="id_43" directLink="deny">
    <Transition value="aaa.aspx" label="aaa" mode ="T"/>
    <Transition value="bbb.aspx" label="bbb" mode ="R"/>
    <Transition value="ccc.aspx" label="ccc" mode ="T"/>
    <Transition value="ddd.aspx" label="ddd" mode ="R"/>
    <Transition value="eee.aspx" label="eee" mode ="T"/>
  </Screen>
  <Screen value="id_44" directLink="deny">
    <Transition value="aaa.aspx" label="aaa" mode ="T"/>
    <Transition value="bbb.aspx" label="bbb" mode ="R"/>
    <Transition value="ccc.aspx" label="ccc" mode ="T"/>
    <Transition value="ddd.aspx" label="ddd" mode ="R"/>
    <Transition value="eee.aspx" label="eee" mode ="T"/>
  </Screen>
  <Screen value="id_45" directLink="deny">
    <Transition value="aaa.aspx" label="aaa" mode ="T"/>
    <Transition value="bbb.aspx" label="bbb" mode ="R"/>
    <Transition value="ccc.aspx" label="ccc" mode ="T"/>
    <Transition value="ddd.aspx" label="ddd" mode ="R"/>
    <Transition value="eee.aspx" label="eee" mode ="T"/>
  </Screen>
  <Screen value="id_46" directLink="deny">
    <Transition value="aaa.aspx" label="aaa" mode ="T"/>
    <Transition value="bbb.aspx" label="bbb" mode ="R"/>
    <Transition value="ccc.aspx" label="ccc" mode ="T"/>
    <Transition value="ddd.aspx" label="ddd" mode ="R"/>
    <Transition value="eee.aspx" label="eee" mode ="T"/>
  </Screen>
  <Screen value="id_47" directLink="deny">
    <Transition value="aaa.aspx" label="aaa" mode ="T"/>
    <Transition value="bbb.aspx" label="bbb" mode ="R"/>
    <Transition value="ccc.aspx" label="ccc" mode ="T"/>
    <Transition value="ddd.aspx" label="ddd" mode ="R"/>
    <Transition value="eee.aspx" label="eee" mode ="T"/>
  </Screen>
  <Screen value="id_48" directLink="deny">
    <Transition value="aaa.aspx" label="aaa" mode ="T"/>
    <Transition value="bbb.aspx" label="bbb" mode ="R"/>
    <Transition value="ccc.aspx" label="ccc" mode ="T"/>
    <Transition value="ddd.aspx" label="ddd" mode ="R"/>
    <Transition value="eee.aspx" label="eee" mode ="T"/>
  </Screen>
  <Screen value="id_49" directLink="deny">
    <Transition value="aaa.aspx" label="aaa" mode ="T"/>
    <Transition value="bbb.aspx" label="bbb" mode ="R"/>
    <Transition value="ccc.aspx" label="ccc" mode ="T"/>
    <Transition value="ddd.aspx" label="ddd" mode ="R"/>
    <Transition value="eee.aspx" label="eee" mode ="T"/>
  </Screen>
  <Screen value="id_50" directLink="deny">
    <Transition value="aaa.aspx" label="aaa" mode ="T"/>
    <Transition value="bbb.aspx" label="bbb" mode ="R"/>
    <Transition value="ccc.aspx" label="ccc" mode ="T"/>
    <Transition value="ddd.aspx" label="ddd" mode ="R"/>
    <Transition value="eee.aspx" label="eee" mode ="T"/>
  </Screen>
  <Screen value="id_51" directLink="deny">
    <Transition value="aaa.aspx" label="aaa" mode ="T"/>
    <Transition value="bbb.aspx" label="bbb" mode ="R"/>
    <Transition value="ccc.aspx" label="ccc" mode ="T"/>
    <Transition value="ddd.aspx" label="ddd" mode ="R"/>
    <Transition value="eee.aspx" label="eee" mode ="T"/>
  </Screen>
  <Screen value="id_52" directLink="deny">
    <Transition value="aaa.aspx" label="aaa" mode ="T"/>
    <Transition value="bbb.aspx" label="bbb" mode ="R"/>
    <Transition value="ccc.aspx" label="ccc" mode ="T"/>
    <Transition value="ddd.aspx" label="ddd" mode ="R"/>
    <Transition value="eee.aspx" label="eee" mode ="T"/>
  </Screen>
  <Screen value="id_53" directLink="deny">
    <Transition value="aaa.aspx" label="aaa" mode ="T"/>
    <Transition value="bbb.aspx" label="bbb" mode ="R"/>
    <Transition value="ccc.aspx" label="ccc" mode ="T"/>
    <Transition value="ddd.aspx" label="ddd" mode ="R"/>
    <Transition value="eee.aspx" label="eee" mode ="T"/>
  </Screen>
  <Screen value="id_54" directLink="deny">
    <Transition value="aaa.aspx" label="aaa" mode ="T"/>
    <Transition value="bbb.aspx" label="bbb" mode ="R"/>
    <Transition value="ccc.aspx" label="ccc" mode ="T"/>
    <Transition value="ddd.aspx" label="ddd" mode ="R"/>
    <Transition value="eee.aspx" label="eee" mode ="T"/>
  </Screen>
  <Screen value="id_55" directLink="deny">
    <Transition value="aaa.aspx" label="aaa" mode ="T"/>
    <Transition value="bbb.aspx" label="bbb" mode ="R"/>
    <Transition value="ccc.aspx" label="ccc" mode ="T"/>
    <Transition value="ddd.aspx" label="ddd" mode ="R"/>
    <Transition value="eee.aspx" label="eee" mode ="T"/>
  </Screen>
  <Screen value="id_56" directLink="deny">
    <Transition value="aaa.aspx" label="aaa" mode ="T"/>
    <Transition value="bbb.aspx" label="bbb" mode ="R"/>
    <Transition value="ccc.aspx" label="ccc" mode ="T"/>
    <Transition value="ddd.aspx" label="ddd" mode ="R"/>
    <Transition value="eee.aspx" label="eee" mode ="T"/>
  </Screen>
  <Screen value="id_57" directLink="deny">
    <Transition value="aaa.aspx" label="aaa" mode ="T"/>
    <Transition value="bbb.aspx" label="bbb" mode ="R"/>
    <Transition value="ccc.aspx" label="ccc" mode ="T"/>
    <Transition value="ddd.aspx" label="ddd" mode ="R"/>
    <Transition value="eee.aspx" label="eee" mode ="T"/>
  </Screen>
  <Screen value="id_58" directLink="deny">
    <Transition value="aaa.aspx" label="aaa" mode ="T"/>
    <Transition value="bbb.aspx" label="bbb" mode ="R"/>
    <Transition value="ccc.aspx" label="ccc" mode ="T"/>
    <Transition value="ddd.aspx" label="ddd" mode ="R"/>
    <Transition value="eee.aspx" label="eee" mode ="T"/>
  </Screen>
  <Screen value="id_59" directLink="deny">
    <Transition value="aaa.aspx" label="aaa" mode ="T"/>
    <Transition value="bbb.aspx" label="bbb" mode ="R"/>
    <Transition value="ccc.aspx" label="ccc" mode ="T"/>
    <Transition value="ddd.aspx" label="ddd" mode ="R"/>
    <Transition value="eee.aspx" label="eee" mode ="T"/>
  </Screen>
  <Screen value="id_60" directLink="deny">
    <Transition value="aaa.aspx" label="aaa" mode ="T"/>
    <Transition value="bbb.aspx" label="bbb" mode ="R"/>
    <Transition value="ccc.aspx" label="ccc" mode ="T"/>
    <Transition value="ddd.aspx" label="ddd" mode ="R"/>
    <Transition value="eee.aspx" label="eee" mode ="T"/>
  </Screen>
  <Screen value="id_61" directLink="deny">
    <Transition value="aaa.aspx" label="aaa" mode ="T"/>
    <Transition value="bbb.aspx" label="bbb" mode ="R"/>
    <Transition value="ccc.aspx" label="ccc" mode ="T"/>
    <Transition value="ddd.aspx" label="ddd" mode ="R"/>
    <Transition value="eee.aspx" label="eee" mode ="T"/>
  </Screen>
  <Screen value="id_62" directLink="deny">
    <Transition value="aaa.aspx" label="aaa" mode ="T"/>
    <Transition value="bbb.aspx" label="bbb" mode ="R"/>
    <Transition value="ccc.aspx" label="ccc" mode ="T"/>
    <Transition value="ddd.aspx" label="ddd" mode ="R"/>
    <Transition value="eee.aspx" label="eee" mode ="T"/>
  </Screen>
  <Screen value="id_63" directLink="deny">
    <Transition value="aaa.aspx" label="aaa" mode ="T"/>
    <Transition value="bbb.aspx" label="bbb" mode ="R"/>
    <Transition value="ccc.aspx" label="ccc" mode ="T"/>
    <Transition value="ddd.aspx" label="ddd" mode ="R"/>
    <Transition value="eee.aspx" label="eee" mode ="T"/>
  </Screen>
  <Screen value="id_64" directLink="deny">
    <Transition value="aaa.aspx" label="aaa" mode ="T"/>
    <Transition value="bbb.aspx" label="bbb" mode ="R"/>
    <Transition value="ccc.aspx" label="ccc" mode ="T"/>
    <Transition value="ddd.aspx" label="ddd" mode ="R"/>
    <Transition value="eee.aspx" label="eee" mode ="T"/>
  </Screen>
  <Screen value="id_65" directLink="deny">
    <Transition value="aaa.aspx" label="aaa" mode ="T"/>
    <Transition value="bbb.aspx" label="bbb" mode ="R"/>
    <Transition value="ccc.aspx" label="ccc" mode ="T"/>
    <Transition value="ddd.aspx" label="ddd" mode ="R"/>
    <Transition value="eee.aspx" label="eee" mode ="T"/>
  </Screen>
  <Screen value="id_66" directLink="deny">
    <Transition value="aaa.aspx" label="aaa" mode ="T"/>
    <Transition value="bbb.aspx" label="bbb" mode ="R"/>
    <Transition value="ccc.aspx" label="ccc" mode ="T"/>
    <Transition value="ddd.aspx" label="ddd" mode ="R"/>
    <Transition value="eee.aspx" label="eee" mode ="T"/>
  </Screen>
  <Screen value="id_67" directLink="deny">
    <Transition value="aaa.aspx" label="aaa" mode ="T"/>
    <Transition value="bbb.aspx" label="bbb" mode ="R"/>
    <Transition value="ccc.aspx" label="ccc" mode ="T"/>
    <Transition value="ddd.aspx" label="ddd" mode ="R"/>
    <Transition value="eee.aspx" label="eee" mode ="T"/>
  </Screen>
  <Screen value="id_68" directLink="deny">
    <Transition value="aaa.aspx" label="aaa" mode ="T"/>
    <Transition value="bbb.aspx" label="bbb" mode ="R"/>
    <Transition value="ccc.aspx" label="ccc" mode ="T"/>
    <Transition value="ddd.aspx" label="ddd" mode ="R"/>
    <Transition value="eee.aspx" label="eee" mode ="T"/>
  </Screen>
  <Screen value="id_69" directLink="deny">
    <Transition value="aaa.aspx" label="aaa" mode ="T"/>
    <Transition value="bbb.aspx" label="bbb" mode ="R"/>
    <Transition value="ccc.aspx" label="ccc" mode ="T"/>
    <Transition value="ddd.aspx" label="ddd" mode ="R"/>
    <Transition value="eee.aspx" label="eee" mode ="T"/>
  </Screen>
  <Screen value="id_70" directLink="deny">
    <Transition value="aaa.aspx" label="aaa" mode ="T"/>
    <Transition value="bbb.aspx" label="bbb" mode ="R"/>
    <Transition value="ccc.aspx" label="ccc" mode ="T"/>
    <Transition value="ddd.aspx" label="ddd" mode ="R"/>
    <Transition value="eee.aspx" label="eee" mode ="T"/>
  </Screen>
  <Screen value="id_71" directLink="deny">
    <Transition value="aaa.aspx" label="aaa" mode ="T"/>
    <Transition value="bbb.aspx" label="bbb" mode ="R"/>
    <Transition value="ccc.aspx" label="ccc" mode ="T"/>
    <Transition value="ddd.aspx" label="ddd" mode ="R"/>
    <Transition value="eee.aspx" label="eee" mode ="T"/>
  </Screen>
  <Screen value="id_72" directLink="deny">
    <Transition value="aaa.aspx" label="aaa" mode ="T"/>
    <Transition value="bbb.aspx" label="bbb" mode ="R"/>
    <Transition value="ccc.aspx" label="ccc" mode ="T"/>
    <Transition value="ddd.aspx" label="ddd" mode ="R"/>
    <Transition value="eee.aspx" label="eee" mode ="T"/>
  </Screen>
  <Screen value="id_73" directLink="deny">
    <Transition value="aaa.aspx" label="aaa" mode ="T"/>
    <Transition value="bbb.aspx" label="bbb" mode ="R"/>
    <Transition value="ccc.aspx" label="ccc" mode ="T"/>
    <Transition value="ddd.aspx" label="ddd" mode ="R"/>
    <Transition value="eee.aspx" label="eee" mode ="T"/>
  </Screen>
  <Screen value="id_74" directLink="deny">
    <Transition value="aaa.aspx" label="aaa" mode ="T"/>
    <Transition value="bbb.aspx" label="bbb" mode ="R"/>
    <Transition value="ccc.aspx" label="ccc" mode ="T"/>
    <Transition value="ddd.aspx" label="ddd" mode ="R"/>
    <Transition value="eee.aspx" label="eee" mode ="T"/>
  </Screen>
  <Screen value="id_75" directLink="deny">
    <Transition value="aaa.aspx" label="aaa" mode ="T"/>
    <Transition value="bbb.aspx" label="bbb" mode ="R"/>
    <Transition value="ccc.aspx" label="ccc" mode ="T"/>
    <Transition value="ddd.aspx" label="ddd" mode ="R"/>
    <Transition value="eee.aspx" label="eee" mode ="T"/>
  </Screen>
  <Screen value="id_76" directLink="deny">
    <Transition value="aaa.aspx" label="aaa" mode ="T"/>
    <Transition value="bbb.aspx" label="bbb" mode ="R"/>
    <Transition value="ccc.aspx" label="ccc" mode ="T"/>
    <Transition value="ddd.aspx" label="ddd" mode ="R"/>
    <Transition value="eee.aspx" label="eee" mode ="T"/>
  </Screen>
  <Screen value="id_77" directLink="deny">
    <Transition value="aaa.aspx" label="aaa" mode ="T"/>
    <Transition value="bbb.aspx" label="bbb" mode ="R"/>
    <Transition value="ccc.aspx" label="ccc" mode ="T"/>
    <Transition value="ddd.aspx" label="ddd" mode ="R"/>
    <Transition value="eee.aspx" label="eee" mode ="T"/>
  </Screen>
  <Screen value="id_78" directLink="deny">
    <Transition value="aaa.aspx" label="aaa" mode ="T"/>
    <Transition value="bbb.aspx" label="bbb" mode ="R"/>
    <Transition value="ccc.aspx" label="ccc" mode ="T"/>
    <Transition value="ddd.aspx" label="ddd" mode ="R"/>
    <Transition value="eee.aspx" label="eee" mode ="T"/>
  </Screen>
  <Screen value="id_79" directLink="deny">
    <Transition value="aaa.aspx" label="aaa" mode ="T"/>
    <Transition value="bbb.aspx" label="bbb" mode ="R"/>
    <Transition value="ccc.aspx" label="ccc" mode ="T"/>
    <Transition value="ddd.aspx" label="ddd" mode ="R"/>
    <Transition value="eee.aspx" label="eee" mode ="T"/>
  </Screen>
  <Screen value="id_80" directLink="deny">
    <Transition value="aaa.aspx" label="aaa" mode ="T"/>
    <Transition value="bbb.aspx" label="bbb" mode ="R"/>
    <Transition value="ccc.aspx" label="ccc" mode ="T"/>
    <Transition value="ddd.aspx" label="ddd" mode ="R"/>
    <Transition value="eee.aspx" label="eee" mode ="T"/>
  </Screen>
  <Screen value="id_81" directLink="deny">
    <Transition value="aaa.aspx" label="aaa" mode ="T"/>
    <Transition value="bbb.aspx" label="bbb" mode ="R"/>
    <Transition value="ccc.aspx" label="ccc" mode ="T"/>
    <Transition value="ddd.aspx" label="ddd" mode ="R"/>
    <Transition value="eee.aspx" label="eee" mode ="T"/>
  </Screen>
  <Screen value="id_82" directLink="deny">
    <Transition value="aaa.aspx" label="aaa" mode ="T"/>
    <Transition value="bbb.aspx" label="bbb" mode ="R"/>
    <Transition value="ccc.aspx" label="ccc" mode ="T"/>
    <Transition value="ddd.aspx" label="ddd" mode ="R"/>
    <Transition value="eee.aspx" label="eee" mode ="T"/>
  </Screen>
  <Screen value="id_83" directLink="deny">
    <Transition value="aaa.aspx" label="aaa" mode ="T"/>
    <Transition value="bbb.aspx" label="bbb" mode ="R"/>
    <Transition value="ccc.aspx" label="ccc" mode ="T"/>
    <Transition value="ddd.aspx" label="ddd" mode ="R"/>
    <Transition value="eee.aspx" label="eee" mode ="T"/>
  </Screen>
  <Screen value="id_84" directLink="deny">
    <Transition value="aaa.aspx" label="aaa" mode ="T"/>
    <Transition value="bbb.aspx" label="bbb" mode ="R"/>
    <Transition value="ccc.aspx" label="ccc" mode ="T"/>
    <Transition value="ddd.aspx" label="ddd" mode ="R"/>
    <Transition value="eee.aspx" label="eee" mode ="T"/>
  </Screen>
  <Screen value="id_85" directLink="deny">
    <Transition value="aaa.aspx" label="aaa" mode ="T"/>
    <Transition value="bbb.aspx" label="bbb" mode ="R"/>
    <Transition value="ccc.aspx" label="ccc" mode ="T"/>
    <Transition value="ddd.aspx" label="ddd" mode ="R"/>
    <Transition value="eee.aspx" label="eee" mode ="T"/>
  </Screen>
  <Screen value="id_86" directLink="deny">
    <Transition value="aaa.aspx" label="aaa" mode ="T"/>
    <Transition value="bbb.aspx" label="bbb" mode ="R"/>
    <Transition value="ccc.aspx" label="ccc" mode ="T"/>
    <Transition value="ddd.aspx" label="ddd" mode ="R"/>
    <Transition value="eee.aspx" label="eee" mode ="T"/>
  </Screen>